title,category,source_org,url,year,pages,words,local_path,sha256
HEWITT v. UNITED STATES,judgments,Supreme Court of the United States,https://www.supremecourt.gov/opinions/24pdf/606us1r61_2dp3.pdf,2024,44,15280,dataset\judgments\hewitt_v_united_states.pdf,e97e497ae03807852e809b712653e4f64efa6b818be7f48a02a1beb3869817d2
GUTIERREZ v. SAENZ et al,judgments,Supreme Court of the United States,https://www.supremecourt.gov/opinions/24pdf/606us1r59_g31h.pdf,2024,54,18542,dataset\judgments\gutierrez_v_saenz_et_al.pdf,13f4072b0746020ed2b37b2df58a1cd05253dadfe89c1a2d9b3121b6b3ffaec1
"RILEY v. BONDI, ATTORNEY GENERAL",judgments,Supreme Court of the United States,https://www.supremecourt.gov/opinions/24pdf/606us1r58_5h25.pdf,2024,48,16283,dataset\judgments\riley_v_bondi_attorney_general.pdf,5bf1012a4d4cf70aae4a1b1db2d896736fbe82332e7c6b85ca2488dcc43403ef
FOOD AND DRUG ADMINISTRATION et al v. R. J. REYNOLDS VAPOR CO. et al,judgments,Supreme Court of the United States,https://www.supremecourt.gov/opinions/24pdf/606us1r57_n6io.pdf,2024,35,11968,dataset\judgments\food_and_drug_administration_et_al_v_r_j.pdf,45eca458b4c9706cb6cf62ef9761b3a544206ee8defe3927503f6c75364ab586
ESTERAS v. UNITED STATES,judgments,Supreme Court of the United States,https://www.supremecourt.gov/opinions/24pdf/606us1r56_bq7d.pdf,2024,43,14680,dataset\judgments\esteras_v_united_states.pdf,d45a4197f26807aba7615e1ddf1933cb4bd86508a89df46f44b64e15336cede4
"McLAUGHLIN CHIROPRACTIC ASSOCIATES, INC v. McKESSON CORP. et al",judgments,Supreme Court of the United States,https://www.supremecourt.gov/opinions/24pdf/606us1r55_3d9g.pdf,2024,41,13893,dataset\judgments\mclaughlin_chiropractic_associates_inc_v_mckesson_corp_et_al.pdf,903dbe41e1267aaf125f2cbca1836df3b8ae0fc0fb76f6492613d2f9f145120f
"DIAMOND ALTERNATIVE ENERGY, LLC, et al v. ENVIRONMENTAL PROTECTION AGENCY et al",judgments,Supreme Court of the United States,https://www.supremecourt.gov/opinions/24pdf/606us1r54_j4ek.pdf,2024,48,15790,dataset\judgments\diamond_alternative_energy_llc_et_al_v_environmental_protection_agency.pdf,b5d7daa366245deda468df4b5f19d0cc00a08aeeada5d83c308abad031571c2a
"STANLEY v. CITY OF SANFORD, FLORIDA",judgments,Supreme Court of the United States,https://www.supremecourt.gov/opinions/24pdf/606us1r53_5i36.pdf,2024,56,19310,dataset\judgments\stanley_v_city_of_sanford_florida.pdf,eeb94ef457b828e26c9932a43b6311de3f645ed2b2251caa6d8b1f7190d0883c
FULD et al v. PALESTINE LIBERATION ORGANIZATION et al,judgments,Supreme Court of the United States,https://www.supremecourt.gov/opinions/24pdf/606us1r52_3eah.pdf,2024,47,15479,dataset\judgments\fuld_et_al_v_palestine_liberation.pdf,40cc667d588bdba0c030ac314608d52fbf94b1f5b7152f014ec55723ce7eabbe
NUCLEAR REGULATORY COMMISSION et al v. TEXAS et al,judgments,Supreme Court of the United States,https://www.supremecourt.gov/opinions/24pdf/605us2r51_4f57.pdf,2024,51,17092,dataset\judgments\nuclear_regulatory_commission_et_al_v_texas_et_al.pdf,98dc84420df006fb94835269e9e88bd2e2a8f206be5762daeffd2f41a431bae6
"ENVIRONMENTAL PROTECTION AGENCY v. CALUMET SHREVEPORT REFINING, L.L.C., et al",judgments,Supreme Court of the United States,https://www.supremecourt.gov/opinions/24pdf/605us2r50_g2hk.pdf,2024,40,13241,dataset\judgments\environmental_protection_agency_v_calu.pdf,9ba92e34aa7a5df33e91702e1d18cdb675d83c827c65951dfa15d780c773e8fc
OKLAHOMA et al v. ENVIRONMENTAL PROTECTION AGENCY et al,judgments,Supreme Court of the United States,https://www.supremecourt.gov/opinions/24pdf/605us2r49_pok0.pdf,2024,20,6441,dataset\judgments\oklahoma_et_al_v_environmental.pdf,6e1293decc758c7c322b748ee8f01065b0fc60d21f9ac27a44e264918d695fa0
PERTTU v. RICHARDS,judgments,Supreme Court of the United States,https://www.supremecourt.gov/opinions/24pdf/605us2r47_bqm2.pdf,2024,37,13068,dataset\judgments\perttu_v_richards.pdf,d9bcfe43d5d8593b765f8ba8dacca1517d1601e340f4c84c2eb9cfe519861c48
"RIVERS v. GUERRERO, DIRECTOR, TEXAS DEPARTMENT OF CRIMINAL JUSTICE, CORRECTIONAL INSTITUTIONS DIVISION",judgments,Supreme Court of the United States,https://www.supremecourt.gov/opinions/24pdf/605us2r46_kjfm.pdf,2024,19,6222,dataset\judgments\rivers_v_guerrero_director_texas_de.pdf,2b97ff6b76054c9ac57e987676a8ec6a7d32c1bbfa6ffc51042e7a2b4555a8b5
COMMISSIONER OF INTERNAL REVENUE v. ZUCH,judgments,Supreme Court of the United States,https://www.supremecourt.gov/opinions/24pdf/605us2r45_3f14.pdf,2024,23,7795,dataset\judgments\commissioner_of_internal_revenue_v_zuch.pdf,c72b9eaf400f4f0d9fbbf464bcb3343e2b5cdb4c0828b6db7eb912324b7c7551
"MARTIN, individually and as parent and next friend of G. W., a minor, et al v. UNITED STATES et al",judgments,Supreme Court of the United States,https://www.supremecourt.gov/opinions/24pdf/605us2r44_4f57.pdf,2024,29,9410,dataset\judgments\g_w_a_minor_et_al_v_united.pdf,8933bf7d996bc5c2ae8ab08459d4a3adc78f35aa83b11886d7b89cba3e00f97b
PARRISH v. UNITED STATES,judgments,Supreme Court of the United States,https://www.supremecourt.gov/opinions/24pdf/605us2r43_e29g.pdf,2024,21,6942,dataset\judgments\parrish_v_united_states.pdf,2ef27744581013d7493d44266ef3b455becb446d4e372ba307342b2814924c14
"SOTO, individually and on behalf of all others similarly situated v. UNITED STATES",judgments,Supreme Court of the United States,https://www.supremecourt.gov/opinions/24pdf/605us2r42_k5fl.pdf,2024,18,5690,dataset\judgments\see_illinois_surety_co_v_united_states_ex_rel_peeler.pdf,5e7c6d18dd0ae60698c1105912ac4e107927d376d3733d3e69209c624f0d6e55
"A. J. T., by and through her parents, A. T., et al v. OSSEO AREA SCHOOLS, INDEPENDENT SCHOOL DISTRICT NO. 279, et al",judgments,Supreme Court of the United States,https://www.supremecourt.gov/opinions/24pdf/605us2r41_bp7c.pdf,2024,27,9208,dataset\judgments\a_j_t_by_and_through_her_parents_a_t_et_al_v_osseo_area_schools_indepe.pdf,c7f7f47ffad4432638caa73968012e870208d9f094db359790334a7d1832cfb7
AMES v. OHIO DEPT. OF YOUTH SERVICES,judgments,Supreme Court of the United States,https://www.supremecourt.gov/opinions/24pdf/605us1r39_kkg1.pdf,2024,26,8366,dataset\judgments\ames_v_ohio_dept_of_youth_services.pdf,d4d84b175bc99b5f4b1a74c5c6fab70031b128fb4aac82f4e7e9935684b1f7c0
"SMITH & WESSON BRANDS, INC., et al v. ESTADOS UNIDOS MEXICANOS",judgments,Supreme Court of the United States,https://www.supremecourt.gov/opinions/24pdf/605us1r38_j426.pdf,2024,25,8641,dataset\judgments\smith_wesson_brands_inc_et_al_v_estados.pdf,3bf648c8d88b1204f354168f13ac94f67f750f69238f07786c7992e063eb7a66
"CATHOLIC CHARITIES BUREAU, INC., et al v. WISCONSIN LABOR AND INDUSTRY REVIEW COMMISSION et al",judgments,Supreme Court of the United States,https://www.supremecourt.gov/opinions/24pdf/605us1r37_986b.pdf,2024,44,14173,dataset\judgments\catholic_charities_bureau_inc_et_al_v_wisconsin_labor_and_industry_rev.pdf,44dee03581c22cc57dd2cb2a58c95f1b7d37b8b31b83a35ab7b781e931187dc8
DEVAS (MAURITIUS) LTD. et al v. ANTRIX CORP. LTD. et al,judgments,Supreme Court of the United States,https://www.supremecourt.gov/opinions/24pdf/605us1r36_4f14.pdf,2024,17,5152,dataset\judgments\devas_mauritius_ltd_et_al_v_antrix.pdf,61e5766206c58fdc9e8773ca47bd9c43155c62a012d2aa0dfb9a9410d5de43a2
BLOM BANK SAL v. HONICKMAN et al,judgments,Supreme Court of the United States,https://www.supremecourt.gov/opinions/24pdf/605us1r35_4f14.pdf,2024,21,6638,dataset\judgments\blom_bank_sal_v_honickman_et_al.pdf,29b956d5b985309b9b690ecb191c032b3d8c7afb2387c12c3a6a7acbe69652f7
"SEVEN COUNTY INFRASTRUCTURE COALITION et al v. EAGLE COUNTY, COLORADO, et al",judgments,Supreme Court of the United States,https://www.supremecourt.gov/opinions/24pdf/605us1r34_h3ci.pdf,2024,38,12845,dataset\judgments\robertson_v_methow_valley_citi.pdf,58b34001b0e43c40da1d5485feda45faf35837241f8493caca21da041d385396
KOUSISIS et al v. UNITED STATES,judgments,Supreme Court of the United States,https://www.supremecourt.gov/opinions/24pdf/605us1r32_f2ah.pdf,2024,53,18532,dataset\judgments\kousisis_et_al_v_united_states.pdf,84a0f5065a945f62cf1db8406860aefb5c3f52c70d887dc8b06b125872531670
"A. A. R. P. et al v. TRUMP, PRESIDENT OF THE UNITED STATES, et al",judgments,Supreme Court of the United States,https://www.supremecourt.gov/opinions/24pdf/605us1r31_7k47.pdf,2024,25,8203,dataset\judgments\a_a_r_p_et_al_v_trump_president_of_the.pdf,19fb94ec530c6871d4474b9b2e30a425dd80fe6f7026b707247daf62f90a55df
"BARNES, individually and as representative of the ESTATE OF BARNES, DECEASED v. FELIX et al",judgments,Supreme Court of the United States,https://www.supremecourt.gov/opinions/24pdf/605us1r30_h315.pdf,2024,20,6585,dataset\judgments\estate_of_barnes_deceased_v_felix_et_al.pdf,2454ec25332d9fc45e9e38c0b0af24881f604092c21d3574adcd338e35f255d1
FELICIANO v. DEPARTMENT OF TRANSPORTATION,judgments,Supreme Court of the United States,https://www.supremecourt.gov/opinions/24pdf/605us1r29_bp7c.pdf,2024,37,12328,dataset\judgments\feliciano_v_department_of_transportation.pdf,5080e91a9d106a41538890d85d639a943c7d47c606fff7a7f66ecd4c653c2535
"ADVOCATE CHRIST MEDICAL CENTER et al v. KENNEDY, SECRETARY OF HEALTH AND HUMAN SERVICES",judgments,Supreme Court of the United States,https://www.supremecourt.gov/opinions/24pdf/605us1r28_limq.pdf,2024,39,13041,dataset\judgments\advocate_christ_medical_center_et_al_v_kennedy_secretary_of_health_and.pdf,e2adc6205d74a8cf7c8f79ea53deffafa7402414808b78c68e9ef539514f1d5f
"Continuing Appropriations and Extensions Act, 2025",acts,GovInfo (U.S. GPO),https://www.govinfo.gov/content/pkg/PLAW-118publ83/pdf/PLAW-118publ83.pdf,,21,9076,dataset\acts\continuing_appropriations_and_extensions_act_2025.pdf,c1230e576b99480e9bf1dc80991cfce792229dc807044cf0b4e1a971b5425596
Fire Grants and Safety Act of 2023,acts,GovInfo (U.S. GPO),https://www.govinfo.gov/content/pkg/PLAW-118publ67/pdf/PLAW-118publ67.pdf,,36,15207,dataset\acts\fire_grants_and_safety_act_of_2023.pdf,d931ed82cbfac7acbf006915f1442efa12cf712aa11c1d5d031a44a475a8ba7c
Fiscal Responsibility Act of 2023,acts,GovInfo (U.S. GPO),https://www.govinfo.gov/content/pkg/PLAW-118publ5/pdf/PLAW-118publ5.pdf,,41,18071,dataset\acts\fiscal_responsibility_act_of_2023.pdf,10744eeb112c588510e6420b9c8b6aad93204c9f6acf15a77bc67d328adcd55e
Reforming Intelligence and Securing America Act,acts,GovInfo (U.S. GPO),https://www.govinfo.gov/content/pkg/PLAW-118publ49/pdf/PLAW-118publ49.pdf,,34,14753,dataset\acts\reforming_intelligence_and_securing_america_act.pdf,05016007ba794a668345bb64e420f1e2a6da1a559e9f993bf697d96607e6fcd0
Supporting America’s Children and Families Act,acts,GovInfo (U.S. GPO),https://www.govinfo.gov/content/pkg/PLAW-118publ258/pdf/PLAW-118publ258.pdf,,26,11580,dataset\acts\supporting_america.pdf,69bf5f21274c681080e39c5f6e711cb3b7f9f5562e09615556f1941735efc008
"American Relief Act, 2025",acts,GovInfo (U.S. GPO),https://www.govinfo.gov/content/pkg/PLAW-118publ158/pdf/PLAW-118publ158.pdf,,52,21377,dataset\acts\american_relief_act_2025.pdf,877a8a57794a5501bbe25361241b00ecb63d838a0edeb91be9f8c5666af0b7f3
Good Samaritan Remediation of Abandoned Hardrock Mines Act of 2024,acts,GovInfo (U.S. GPO),https://www.govinfo.gov/content/pkg/PLAW-118publ155/pdf/PLAW-118publ155.pdf,,25,10219,dataset\acts\good_samaritan_remediation_of_abandoned_hardrock_mines_act_of_2024.pdf,12b22e3ac4cb667ec0db5c50089cbfcb2bde83f34fb120f986c1a3e672f8d851
"Continuing Appropriations Act, 2024 and Other Extensions Act",acts,GovInfo (U.S. GPO),https://www.govinfo.gov/content/pkg/PLAW-118publ15/pdf/PLAW-118publ15.pdf,,29,12697,dataset\acts\continuing_appropriations_act_2024_and_other_extensions_act.pdf,96bee2e882435f25f42181b1280eef616c5f07c3f13d0949c1e144e213062771
Bolstering Ecosystems Against Coastal Harm Act,acts,GovInfo (U.S. GPO),https://www.govinfo.gov/content/pkg/PLAW-118publ117/pdf/PLAW-118publ117.pdf,,17,7147,dataset\acts\bolstering_ecosystems_against_coastal_harm_act.pdf,25e2519345b5e80836999627e510ae33e11302d8527a2b42cc68ca4917754957
Extending Government Funding and Delivering Emergency Assistance Act,acts,GovInfo (U.S. GPO),https://www.govinfo.gov/content/pkg/PLAW-117publ43/pdf/PLAW-117publ43.pdf,,39,18006,dataset\acts\extending_government_funding_and_delivering_emergency_assistance_act.pdf,4827709deb2c2b5f05cd5fe97257937b48767029f76975e3e310081f2cc50201
Hualapai Tribe Water Rights Settlement Act of 2022,acts,GovInfo (U.S. GPO),https://www.govinfo.gov/content/pkg/PLAW-117publ349/pdf/PLAW-117publ349.pdf,,37,16897,dataset\acts\hualapai_tribe_water_rights_settlement_act_of_2022.pdf,718bdbb2de56f49200f6c9604339f1bf06b72d5f14787618d7691a59aac5d8a0
National Heritage Area Act,acts,GovInfo (U.S. GPO),https://www.govinfo.gov/content/pkg/PLAW-117publ339/pdf/PLAW-117publ339.pdf,,18,7488,dataset\acts\national_heritage_area_act.pdf,40c29a14850885f1567ec158a9e69479878c5b4ed8afff586630c1d59825e73a
Veterans Auto and Education Improvement Act of 2022,acts,GovInfo (U.S. GPO),https://www.govinfo.gov/content/pkg/PLAW-117publ333/pdf/PLAW-117publ333.pdf,,19,8870,dataset\acts\veterans_auto_and_education_improvement_act_of_2022.pdf,f613972c22c9ef3ea8c5be2eb8d14b0f5ab15789091f81cf64da9d30f4b5770d
Safeguard Tribal Objects of Patrimony Act of 2021,acts,GovInfo (U.S. GPO),https://www.govinfo.gov/content/pkg/PLAW-117publ258/pdf/PLAW-117publ258.pdf,,16,5969,dataset\acts\safeguard_tribal_objects_of_patrimony_act_of_2021.pdf,3dbcbded3c6825c1874eac5ab2b0c0f7e1e04b1737847289b7dcf8597d462d04
SBIR and STTR Extension Act of 2022,acts,GovInfo (U.S. GPO),https://www.govinfo.gov/content/pkg/PLAW-117publ183/pdf/PLAW-117publ183.pdf,,17,7208,dataset\acts\sbir_and_sttr_extension_act_of_2022.pdf,643d28b2f625b5986338558c4e6f718e24f5d717a626c5db9831692226fb5415
Sergeant First Class Heath Robinson Honoring our Promise to Address Comprehensive Toxics Act of 2022,acts,GovInfo (U.S. GPO),https://www.govinfo.gov/content/pkg/PLAW-117publ168/pdf/PLAW-117publ168.pdf,,59,27601,dataset\acts\conceding_our_veterans.pdf,9fbe0d4c4b8ca7f1ddeb5330c8f39b60cceb13cb411a9c40c86818e2b0ddcdf4
Bipartisan Safer Communities Act,acts,GovInfo (U.S. GPO),https://www.govinfo.gov/content/pkg/PLAW-117publ159/pdf/PLAW-117publ159.pdf,,32,14365,dataset\acts\bipartisan_safer_communities_act.pdf,eb4da0ff6b95f48bde14cc8a6be738f819029612db4830af8849984ec686517c
Ocean Shipping Reform Act of 2022,acts,GovInfo (U.S. GPO),https://www.govinfo.gov/content/pkg/PLAW-117publ146/pdf/PLAW-117publ146.pdf,,16,6786,dataset\acts\ocean_shipping_reform_act_of_2022.pdf,651a16ffec02155eb9f01398ddc9dd71d86fcfcd5dd68eb6128dfbf139e9ffe8
Postal Service Reform Act of 2022,acts,GovInfo (U.S. GPO),https://www.govinfo.gov/content/pkg/PLAW-117publ108/pdf/PLAW-117publ108.pdf,,27,12422,dataset\acts\postal_service_reform_act_of_2022.pdf,7e4283c4c1dabe2052699c5525f3f606251e84de77ea93638883332bc88bc3c0
"Continuing Appropriations Act, 2020, and Health Extenders Act of 2019",acts,GovInfo (U.S. GPO),https://www.govinfo.gov/content/pkg/PLAW-116publ59/pdf/PLAW-116publ59.pdf,,17,7641,dataset\acts\continuing_appropriations_act_2020_and_health_extenders_act_of_2019.pdf,e5590207793e519251125671926975e8c20a7a7cd7880527c7a68c1749de684c
Coordinated Ocean Observations and Research Act of 2020,acts,GovInfo (U.S. GPO),https://www.govinfo.gov/content/pkg/PLAW-116publ271/pdf/PLAW-116publ271.pdf,,18,7224,dataset\acts\coordinated_ocean_observations_and_research_act_of_2020.pdf,e06f6dc918ee82a757346368e26c71c7c1ee35ee8f17984ec69f68f5eacfab9c
National Oceanic and Atmospheric Administration Commissioned Officer Corps Amendments Act of 2020,acts,GovInfo (U.S. GPO),https://www.govinfo.gov/content/pkg/PLAW-116publ259/pdf/PLAW-116publ259.pdf,,29,12729,dataset\acts\public_law_116_259.pdf,ae0a0eed22cf78d92b32bf3456170d1fcb1686ae46cb344318153683d7007886
Taxpayer First Act,acts,GovInfo (U.S. GPO),https://www.govinfo.gov/content/pkg/PLAW-116publ25/pdf/PLAW-116publ25.pdf,,37,16341,dataset\acts\taxpayer_first_act.pdf,f7354532ff17efbe7ad6081f5837ebbf48ab654affd6ae4c354fe4af7cd52d70
Save Our Seas 2.0 Act,acts,GovInfo (U.S. GPO),https://www.govinfo.gov/content/pkg/PLAW-116publ224/pdf/PLAW-116publ224.pdf,,27,11048,dataset\acts\public_law_116_224.pdf,e2b6113d457a62a73437c157a0978093713b6acaea28fa660a3d9113a10fcbef
"Veterans Comprehensive Prevention, Access to Care, and Treatment Act of 2020",acts,GovInfo (U.S. GPO),https://www.govinfo.gov/content/pkg/PLAW-116publ214/pdf/PLAW-116publ214.pdf,,16,6509,dataset\acts\veterans_comprehensive_prevention_access_to_care_and_treatment_act_of.pdf,0fda9250f000b3ba3e27051e7340aea1daa368c8696a1f3bedf468eedb294092
"Additional Supplemental Appropriations for Disaster Relief Act, 2019",acts,GovInfo (U.S. GPO),https://www.govinfo.gov/content/pkg/PLAW-116publ20/pdf/PLAW-116publ20.pdf,,32,14905,dataset\acts\public_law_116_20.pdf,28bb2e58fc985ccb16386b7c1f0e9995bf18a41b732f36bc4304350f1bfacbdf
"Empowering Olympic, Paralympic, and Amateur Athletes Act of 2020",acts,GovInfo (U.S. GPO),https://www.govinfo.gov/content/pkg/PLAW-116publ189/pdf/PLAW-116publ189.pdf,,31,12829,dataset\acts\empowering_olympic_paralympic_and_amateur_athletes_act_of_2020.pdf,5537e8577adfc2cd7787758dfd1fca19fc54b20ccbd6d830dde996b245cbe7d6
America’s Conservation Enhancement Act,acts,GovInfo (U.S. GPO),https://www.govinfo.gov/content/pkg/PLAW-116publ188/pdf/PLAW-116publ188.pdf,,38,15994,dataset\acts\america.pdf,0102dbe0350e3a1ae4c836e4b79baaae0d6b11cccd9d21bfe1b87dd0055bafbf
Practical Reforms and Other Goals To Reinforce the Effectiveness of Self- Governance and Self-Determination for Indian Tribes Act of 2019,acts,GovInfo (U.S. GPO),https://www.govinfo.gov/content/pkg/PLAW-116publ180/pdf/PLAW-116publ180.pdf,,25,11317,dataset\acts\public_law_116_180.pdf,36778ad40902b35ecae4267f223bc9915255bede746397582f66363d339b8214
Commander John Scott Hannon Veterans Mental Health Care Improvement Act of 2019,acts,GovInfo (U.S. GPO),https://www.govinfo.gov/content/pkg/PLAW-116publ171/pdf/PLAW-116publ171.pdf,,55,24014,dataset\acts\commander_john_scott_hannon_veterans_mental_health_care_improvement_ac.pdf,72a827956d5ca280b2ce00b52d57f9b257004b46e3a9cbfb1acc55e3a44d0989
Nationwide Injunctions and Universal Judicial Relief One Year After Trump v. CASA,pov,Congressional Research Service,https://www.everycrsreport.com/files/2026-07-07_R49022_0668b913d1bbe05ce3a70d2b692579c72593f097.pdf,,28,14858,dataset\pov\nationwide_injunctions_and_universal_judicial_relief_one_year_after_tr.pdf,2e63a051aa656ffc612bf14f0aab51323da81ec794967720c374529d30f37d9d
Marriage Penalties and Bonuses in the Federal Tax Code,pov,Congressional Research Service,https://www.everycrsreport.com/files/2026-07-02_R49020_66e82ccdf32dc36049366a03d45e5f5fe336a7ad.pdf,,50,26962,dataset\pov\marriage_penalties_and_bonuses_in_the_federal_tax_code_everycrsreportc.pdf,8a26141153f01b3085e302f9e5fb165de51b34bf1870ccaebfcaba815be409cd
Financial Services and General Government (FSGG) FY2026 Appropriations: Overview,pov,Congressional Research Service,https://www.everycrsreport.com/files/2026-07-02_R49017_89d0a9cfb476fdad7969a12c0f683e17de8cada5.pdf,,17,6509,dataset\pov\financial_services_and_general_government_fsgg_fy2026_appropriations_o.pdf,2d91cddf531fc06ee2c47fb854341a013c9b246d0f800d19a01cbafc88944b4a
The President’s Removal Power: The Constitutional Convention and the First Congress,pov,Congressional Research Service,https://www.everycrsreport.com/files/2026-06-17_R48999_9ffd1b87d1a2c77705293996a67622d3f5894dce.pdf,,34,21528,dataset\pov\the_presidents_removal_power_the_constitutional_convention_and_the_fir.pdf,2c998c72872a822478fc1b8ae0c88276d068daa5ecce1bf29d3270bf03f37fcb
SBA’s 8(a) Business Development Program: Structure and Current Issues,pov,Congressional Research Service,https://www.everycrsreport.com/files/2026-05-15_R48190_996dfe7ae26713cdd4fc2b50206d12b3737315f0.pdf,,28,13073,dataset\pov\sbas_8a_business_development_program_structure_and_current_issues_ever.pdf,c572faca240788700de888d136a1f32184ffef3e58e4650095209af585e7bf90
Statistics on Women in National Governments Around the World,pov,Congressional Research Service,https://www.everycrsreport.com/files/2026-05-07_R45483_de37ae75e8626baa8cf9c4b8213ac4c8d544c1c5.pdf,,31,10514,dataset\pov\statistics_on_women_in_national_governments_around_the_world_everycrsr.pdf,d4b6977cd4e07a801d7cba79d04cf62b0a899afee3aca3311a9f39013f65c9fd
Introduction to Tribal Forestry,pov,Congressional Research Service,https://www.everycrsreport.com/files/2026-05-04_R48934_e5214293289cd3bdcf3427ea4ce167b24add6352.pdf,,17,7710,dataset\pov\introduction_to_tribal_forestry_everycrsreportcom.pdf,edeeff1f7198601a33c2f42ad2385d28e41579e5489bd3ad53ac9bf827996235
The Vacancies Act: A Legal Overview,pov,Congressional Research Service,https://www.everycrsreport.com/files/2026-04-29_R44997_38c85a5efd106b3c07bb2b8240cd15997a3cccc0.pdf,,40,26247,dataset\pov\the_vacancies_act_a_legal_overview_everycrsreportcom.pdf,a39166cd5af79aa717a3d41fd6afb55068fcb6bbb1bcbe4c76c80d77dc47ef0a
"Availability of Federal Data: Policy Considerations for Disclosure, Preservation, and Governance",pov,Congressional Research Service,https://www.everycrsreport.com/files/2026-03-31_R48889_38399ea821c778e9c23db10291bcf9c161fc1a53.pdf,,31,15127,dataset\pov\availability_of_federal_data_policy_considerations_for_disclosure_pres.pdf,82ba9f8c3df4821b7d4f07a210d76a863a0f19306abe425c477424be5e810dd3
Federal Disaster Assistance for Businesses: Summaries and Policy Options,pov,Congressional Research Service,https://www.everycrsreport.com/files/2026-03-30_R47631_ad585544fa0b8112974fb593c0a371aaf3cf20d4.pdf,,39,16582,dataset\pov\federal_disaster_assistance_for_businesses_summaries_and_policy_option.pdf,fb47f920e00c43977e745a9698db94740f244bbede30a3e8e131c91f6c9fa61f
An Overview of Small Business Contracting,pov,Congressional Research Service,https://www.everycrsreport.com/files/2026-03-18_R45576_35654a96510988c9be6c734e490b140efe37b331.pdf,,36,17436,dataset\pov\an_overview_of_small_business_contracting_everycrsreportcom.pdf,45f42598d6fbf44cb5a990fe9942f1ee18aa4c4674c33fed2991c97d6a6193a3
Small Business Administration (SBA) Funding: Overview and Recent Trends,pov,Congressional Research Service,https://www.everycrsreport.com/files/2026-03-12_R43846_fe8d8076706336484105ce3a9f857f002aa023e6.pdf,,33,10265,dataset\pov\small_business_administration_sba_funding_overview_and_recent_trends_e.pdf,ba94392850954220099e34ddbc807d8abd23155ddc003bebb458ad051296bc87
Federal Grants-in-Aid Administration: A Primer,pov,Congressional Research Service,https://www.everycrsreport.com/files/2026-03-05_R42769_b61757ef13b5e1df2988df921130794db9ca48ae.pdf,,22,8080,dataset\pov\federal_grants_in_aid_administration_a_primer_everycrsreportcom.pdf,4845915139e4ec0aed595afd5a1d54ec436e19ba2f9c860d9d9544345ad40535
Separation of Powers and NATO Withdrawal,pov,Congressional Research Service,https://www.everycrsreport.com/files/2026-02-27_R48868_c32a2ddbfd8c800c3b023e8286dc06c365f792b8.pdf,,38,23995,dataset\pov\separation_of_powers_and_nato_withdrawal_everycrsreportcom.pdf,5c8da7f6bfb95cac06df14ddab877119315ab71a0cba73d3346e3b93e49d2b97
"Military Memorials, Monuments, and Museums: Selected Resources for Federal, State, and Local Funding",pov,Congressional Research Service,https://www.everycrsreport.com/files/2026-02-12_R47337_b5b7f78b07fdff05bc015fb81be65838482d72b9.pdf,,25,7817,dataset\pov\military_memorials_monuments_and_museums_selected_resources_for_federa.pdf,644d5fc7057188bc4c9e30f10dd6b98657a0d88383acfa2f57bf0f2c7db80087
Federal Statistical Data for U.S. Territories: Issues and Resources,pov,Congressional Research Service,https://www.everycrsreport.com/files/2026-01-30_R48522_94db6cca0e8b30182718d9f406adba1d5a8cfbe2.pdf,,31,10401,dataset\pov\federal_statistical_data_for_us_territories_issues_and_resources_every.pdf,5fa471d88ec3796f7b27c7f0e02f7a398599320179c6d54352c843d142fa0ca6
Congressional Commissions: Overview and Considerations for Congress,pov,Congressional Research Service,https://www.everycrsreport.com/files/2026-01-21_R40076_f47401a35cd470d80c1302778f17c60232a87c84.pdf,,25,9517,dataset\pov\congressional_commissions_overview_and_considerations_for_congress_eve.pdf,c60acfe912a2bc0676e862cc5fb1815f03f403642bc64088a93b77e3fd8d12f2
Overview of Continuing Appropriations for FY2026 (Division A of P.L. 119-37),pov,Congressional Research Service,https://www.everycrsreport.com/files/2025-12-15_R48765_f9ba17e6fe5703377b32e61f1d76e3f3d97be29d.pdf,,27,12781,dataset\pov\overview_of_continuing_appropriations_for_fy2026_division_a_of_pl_119.pdf,efc7dd185374f7301f1cf47158d0f96cbf4af26c86e84e1ddcc15950d07fc336
"Crime, the Commerce Clause, and the Internet",pov,Congressional Research Service,https://www.everycrsreport.com/files/2025-12-15_R48764_8d59bcf6959784cc5e8c88a4a66097fba8e44f6e.pdf,,21,12432,dataset\pov\crime_the_commerce_clause_and_the_internet_everycrsreportcom.pdf,3aa785f888f4d1f688fef421855d09e5e2c6814be354e1abc4070189fab8c66c
Federal Voter Eligibility and Voter Registration: Overview and Issues for Congress,pov,Congressional Research Service,https://www.everycrsreport.com/files/2025-11-21_R48735_19ef265d426b9ee9612582b6d1ef86c82e6cb611.pdf,,24,13847,dataset\pov\federal_voter_eligibility_and_voter_registration_overview_and_issues_f.pdf,62c9421256647e680d85efedcdfc8abc846c2070ab778513ffb55f1634300bd1
Examining the Future of PFAS Cleanup and Disposal Policy,pov,Congressional Research Service,https://www.everycrsreport.com/files/2025-11-19_TE10118_88c67733067d9c27b3d0c5ddf70837e27c1ccb2b.pdf,,24,13668,dataset\pov\examining_the_future_of_pfas_cleanup_and_disposal_policy_everycrsrepor.pdf,42b6f7606cca794577e93dfa5d13029f8c7957245be40b0d022e622b4b6509ba
Offshore Wind Energy Development: Legal Framework,pov,Congressional Research Service,https://www.everycrsreport.com/files/2025-08-28_R40175_45b8b0a75b2d2e63a80698a14cc29d14d340f848.pdf,,17,8154,dataset\pov\offshore_wind_energy_development_legal_framework_everycrsreportcom.pdf,079bff31e8e34996b988c7be150dffee034e6ca6b18639695f31595a8d35cb69
